{
  "kind": "reference",
  "level": "PH2",
  "subject": "resnet8-cifar10-fp32",
  "date": "2026-07-04",
  "config": {
    "device": "A3CY100BM16AE7S",
    "board": "Arrow AXC3000",
    "model": "resnet8-cifar10",
    "quantization": "fp32",
    "tool_versions": {
      "python": "3.12.3",
      "tensorflow": "2.16.1",
      "torch": "2.12.1+cu130",
      "torchvision": "0.27.1+cu130",
      "onnx": "1.16.1",
      "onnxruntime": "1.27.0"
    }
  },
  "metrics": {
    "accuracy_top1": 0.8719,
    "n_records": 10000
  },
  "plan_ref": "\u00a75 table",
  "notes": "Full CIFAR-10 test set (10000 images, 1000/class), matches docs/record_format.md's 10,000-record count. Images from the uoft-cs/cifar10 HF Parquet mirror (lossless PNG bytes) -- see module docstring for why a JPEG mirror was rejected (measured ~13-point accuracy hit from lossy re-compression on this 32x32-input model). MLPerf Tiny reference reports ~87.0% top-1 on its own 200-sample perf subset; quality target 85%+ top-1 on the full test set."
}
