{
  "kind": "estimate",
  "level": "L1",
  "subject": "pe-array-fmax-r1x2_heavy_merged",
  "date": "2026-07-05",
  "plan_ref": "\u00a77 L1",
  "config": {
    "device": "A3CY100BM16AE7S",
    "board": "Arrow AXC3000",
    "fclk_mhz": 300,
    "tool_versions": {
      "quartus": "26.1.0 Build 110",
      "python": "3.12.3"
    },
    "pe_grid": {
      "rows": 1,
      "cols": 2,
      "pe_count": 2,
      "n_taps": 10
    },
    "variant": {
      "reset_style": "reset_heavy",
      "clock_domain": "merged"
    },
    "target_clock": "clk",
    "utilization": {
      "dsp": 10,
      "dsp_tensor_mode": 0,
      "alm": 355,
      "m20k": 4
    },
    "fmax_all_clocks_mhz": {
      "clk": 52.82
    },
    "fast_forward_limit": [
      "clk: Insufficient Registers"
    ],
    "report_paths": [
      "quartus/l1_sweep/l1_r1x2_heavy_merged.sta.rpt",
      "quartus/l1_sweep/l1_r1x2_heavy_merged.fit.rpt",
      "quartus/l1_sweep/l1_r1x2_heavy_merged.fit.retime.rpt"
    ]
  },
  "metrics": {
    "fmax_mhz": 52.82
  },
  "notes": "Quartus Timing-Analyzer static-timing estimate (kind=estimate per issue #11: fmax from the timing report until a hardware run), worst corner, restricted fmax of the single (clk) clock at the 300 MHz aggressive SDC target. CLASSIC-mode datapath (dsp_tensor_mode=0, 0 expected \u2014 Agilex 3 tensor mode is unreachable from hand RTL on Quartus 26.1, PLAN \u00a73 LV2 caveat / #9). reset_style=reset_heavy (LV1), clock_domain=merged (LV4). Emitted by scripts/sweep_l1.py."
}
